{
  "profile_id": "profile.reasoning.serve",
  "profile_version": "v1",
  "artifact": {
    "oci_digest": "sha256:0000000000000000000000000000000000000000000000000000000000000000",
    "architecture": "amd64",
    "accelerator_class": "gpu-a100-80g"
  },
  "runtime_contract_ref": "schema://runtime/serve-v1",
  "configuration_schema_ref": "schema://configuration/serve-v1",
  "secrets": [{"name": "model-weights-key", "ref": "secret://tenant-a/model-weights"}],
  "data_dependencies": [{"name": "weights", "digest": "sha256:0000000000000000000000000000000000000000000000000000000000000000"}],
  "health_slo": {"readiness_path": "/readyz", "liveness_path": "/healthz", "target_availability": 0.999},
  "export_procedure": {"ref": "schema://export/serve-v1", "digest": "sha256:0000000000000000000000000000000000000000000000000000000000000000"},
  "license_sbom": {"ref": "schema://license/serve-v1", "digest": "sha256:0000000000000000000000000000000000000000000000000000000000000000"},
  "profile_digest": "sha256:1111111111111111111111111111111111111111111111111111111111111111"
}
